<!DOCTYPE student SYSTEM "student.dtd">

<student id="1">
    <jméno>Jan</jméno>
    <příjmení>Novák</příjmení>
    <studentské_číslo>123456</studentské_číslo>
    <email>jan.novak@example.com</email>
    <studijní_rok>2</studijní_rok>
    <rozvrh>pondělí 8:00 - 12:00, středa 14:00 - 16:00</rozvrh>
    <předměty>
    <předmět>Matematika</předmět>
    <předmět>Fyzika</předmět>
    <!-- další předměty -->
    </předměty>
    <splněné_předměty>
        <splněný_předmět>Anglický jazyk</splněný_předmět>
        <!-- další splněné předměty -->
    </splněné_předměty>
 </student>    
